{
    "$id": "http://example.com/example.json",
    "$schema": "http://json-schema.org/draft-07/schema",
    "default": {},
    "title": "The root schema",
    "description": "The root schema comprises the entire JSON document.",
    "required": [
        "name",
        "link",
        "steps",
        "ingredients"
    ],
    "type": "object",
    "additionalProperties": false,
    "properties": {
        "name": {
            "$id": "#/properties/name",
            "default": "",
            "type": "string"
        },
        "link": {
            "$id": "#/properties/link",
            "default": "",
            "type": "string"
        },
        "yield": {
            "$id": "#/properties/yield",
            "type": "string",
            "default": ""
        },
        "time": {
            "$id": "#/properties/time",
            "type": "string",
            "default": ""
        },
        "steps": {
            "$id": "#/properties/steps",
            "default": [],
            "title": "The steps schema",
            "description": "An explanation about the purpose of this instance.",
            "type": "array",
            "additionalItems": false,
            "items": {
                "$id": "#/properties/steps/items",
                "anyOf": [
                    {
                        "$id": "#/properties/steps/items/anyOf/0",
                        "default": {},
                        "required": [
                            "step",
                            "directions"
                        ],
                        "type": "object",
                        "additionalProperties": true,
                        "properties": {
                            "step": {
                                "$id": "#/properties/steps/items/anyOf/0/properties/step",
                                "default": 0,
                                "type": "integer"
                            },
                            "directions": {
                                "$id": "#/properties/steps/items/anyOf/1/properties/directions",
                                "default": "",
                                "type": "string"
                            }
                        }
                    }
                ]
            }
        },
        "ingredients": {
            "$id": "#/properties/ingredients",
            "default": [],
            "description": "An explanation about the purpose of this instance.",
            "title": "The ingredients schema",
            "type": "array",
            "additionalItems": false,
            "items": {
                "$id": "#/properties/ingredients/items",
                "anyOf": [
                    {
                        "$id": "#/properties/ingredients/items/anyOf/0",
                        "default": {},
                        "required": [
                            "measurement",
                            "amount",
                            "item"
                        ],
                        "additionalProperties": false,
                        "type": "object",
                        "properties": {
                            "measurement": {
                                "$id": "#/properties/ingredients/items/anyOf/0/properties/measurement",
                                "type": "string",
                                "enum": ["tbsp","tsp","cup","can","small","medium","large","taste","lbs","oz","med"]
                            },
                            "amount": {
                                "$id": "#/properties/ingredients/items/anyOf/1/properties/amount",
                                "type": "number"
                            },
                            "item": {
                                "$id": "#/properties/ingredients/items/anyOf/2/properties/item",
                                "type": "string"
                            },
                            "extras": {
                                "$id": "#/properties/ingredients/items/anyOf/3/properties/extras",
                                "type": "string"
                            }
                        }
                    }
                ]
            }
        }
    }
}